2014-12-13 11:44:30	lewyfDanf	人 少し 幸せ なる 欲 深い それ  幸せ すぐ 求める しまう
2014-12-13 04:13:46	lewyfDanf	夜 なる 深い 長い 闇 突入 する 気分 沈み がち ネガティブスパイラル はまる 前 早め 寝る
2014-12-13 01:41:34	lewyfDanf	一瞬 期待 する  辛い 思い する 最初 夢 希望 ない  いい
2014-12-12 14:55:33	lewyfDanf	研究 計画 書 嘘 書ける
2014-12-12 12:27:08	lewyfDanf	リスカ こわい
2014-12-12 09:55:03	lewyfDanf	思考 ネガティブ 行動 ポジティブ
2014-12-12 07:26:34	lewyfDanf	深刻 エラー 起こる いる
2014-12-12 04:56:20	lewyfDanf	あんた ぁ ? さっさと 死ぬ いい !
2014-12-12 02:27:53	lewyfDanf	来世 きっと 報う れる そう 思う やる いける
2014-12-11 23:59:31	lewyfDanf	いつ 執着 する しまう それ 自分 弱い さ 自覚 する  まず 第一歩
2014-12-11 21:30:16	lewyfDanf	生きる てる 意義 わかる
2014-12-11 15:31:29	lewyfDanf	何 辛い 思い 忘れる  新た 決意 する 根本 的 解決 する いる  決意 驚く 脆い あまりに 脆い
2014-12-11 03:05:47	lewyfDanf	ない
2014-12-11 00:35:12	lewyfDanf	希望 的 観測 淡い 期待 する か細い 一筋 光 苦しみ 生み出す いる
2014-12-10 14:02:26	lewyfDanf	戦争 起こる 志願 兵 なる 前線 行く
2014-12-10 11:32:44	lewyfDanf	自分 記憶 リセット できる 自分 上書き する ない
