2017-06-19 20:05:11	posi_tive_sp_	物事 やる ハードル 下げる 10 やる する まず 1 やりとげる いける まず 1 集中 する 終わる せる 考える そう する 自然 取る 掛かれる  なる
2017-06-19 16:30:10	posi_tive_sp_	大丈夫 縁 ある 人 必ず いる 逆 合う 人 いる それ それ 仕方
2017-06-19 15:25:07	posi_tive_sp_	PK 外す  できる  PK 蹴る 勇気 持つ
2017-06-19 14:00:09	posi_tive_sp_	成功 する 楽しい  楽しい やる てる 成功 する  !
2017-06-19 13:20:09	posi_tive_sp_	頑張る 楽しむ  !
2017-06-19 11:15:10	posi_tive_sp_	今日 精一杯 頑張る ええ
2017-06-19 11:10:08	posi_tive_sp_	ひとつ 評価 ひとり 評価 一部 評価 左右 する れる
2017-06-19 08:45:11	posi_tive_sp_	笑顔 ! 笑顔 ! 笑顔 世界 救う ♪ https :// t . co / YqSnTdNhiP
2017-06-19 08:30:11	posi_tive_sp_	生きる いる 傷 ひとつ ふたつ 痛む 部分 ひとつ ふたつ ある
2017-06-19 07:50:08	posi_tive_sp_	今 ある  目 向ける 今 ある  大事 する
2017-06-19 07:05:12	posi_tive_sp_	疲れる 休む また 出直す ええ !!
2017-06-19 06:15:08	posi_tive_sp_	女性 数 世界中 何 千 億 いる  一 人 一 人 人生 ある 顔 ある  これ 美人 これ ブス 型 決める 必要 ない  クヨクヨ する ひま ある もっと 君 自身 心 輝かす 純粋 さ 顔 出す  考える  いい
2017-06-19 05:20:08	posi_tive_sp_	やる 前 負ける  考える いるか !
2017-06-19 04:35:11	posi_tive_sp_	人生 後ろ向き 理解 できる 前向き 生きる られる ! セーレン・キルケゴール
2017-06-19 04:20:10	posi_tive_sp_	生きる 呼吸 する  行動 する   ジャック・ルソー
2017-06-19 04:10:11	posi_tive_sp_	僕 努力 する 自分 嫌い  ボンズ
2017-06-19 03:00:11	posi_tive_sp_	手 抜く  疲れる
2017-06-19 01:20:11	posi_tive_sp_	他人 後ろ 行く  けっして 前進 する いる  ロマン ロラン
2017-06-19 00:30:07	posi_tive_sp_	私 10 回 9 回 失敗 する  気づく 10 倍 働く バーナード・ショウ
2017-06-18 22:50:10	posi_tive_sp_	成功  他人 決める  達成 する  自分 決める  超える いく     利
2017-06-18 22:25:11	posi_tive_sp_	人間 人間 生きる いく  一番 大切  頭 良い 悪い 心 良い 悪い
2017-06-18 20:45:07	posi_tive_sp_	半年 後 あなた いま 瞬間 決まる いる
2017-06-18 20:05:08	posi_tive_sp_	最近 勝ち 組 負け 組み 流行る いる スタート 切る いる どう 僕 大事 思う
2017-06-18 16:30:06	posi_tive_sp_	財産 失う 痛手 健康 失う 痛手 大きい 勇気 失う それ 取り返し つく 作者 不詳
2017-06-18 15:25:08	posi_tive_sp_	お金 使う  ある
2017-06-18 14:00:11	posi_tive_sp_	毎日 今日 人生 最後  しれる 考える する いつか 必ず 考え 正しい  来る  ジョブス
2017-06-18 13:20:09	posi_tive_sp_	私 ライバル 昨日 自分 ベッキー
2017-06-18 11:15:08	posi_tive_sp_	年 とる 人間 若い さ 買える 1 億 円 払う 若い  ポケット 1 億 円 持つ いる  使う いる なくなる しまう お金  使う
2017-06-18 11:10:09	posi_tive_sp_	夢 逃げる 逃げる  いつも 自分
2017-06-18 08:45:09	posi_tive_sp_	負ける 終わる やめる 終わる
2017-06-18 08:30:08	posi_tive_sp_	才能 情熱 持続 する せる 能力
2017-06-18 07:50:07	posi_tive_sp_	父 母 二 人 父 母 両親 四 人 両親 八 人 数える ゆく 十 代 前 千 二 十 四 人 ニ 十 代 前 ...? 何 百 万 人 超す  過去 無量 命 バトン 受ける  いま ここ 自分 番 生きる いる それ あなた 命 それ わたし 命
2017-06-18 07:05:10	posi_tive_sp_	幸福 順位 ない 成功 順位 ある ハーバード 大学 図書館
2017-06-18 06:15:07	posi_tive_sp_	 する てる もっと 未来 目 むける ふりかえる いる 前 見る 進む ドラえもん
2017-06-18 05:20:10	posi_tive_sp_	人生 3 万 日
2017-06-18 04:35:10	posi_tive_sp_	10 年 後 きっと せめて 10 年 いい もどる やり直す 思う いる  今 やり直す 未来 10 年 後 20 年 後 50 年 後 もどる くる  今 2 ちゃん ねる 就職 板
2017-06-18 04:20:11	posi_tive_sp_	大丈夫 ! お金 空 降る くる !!
2017-06-18 04:10:10	posi_tive_sp_	将来 楽しむ  今 捨てる どう する ! 今 みんな 楽しむ !
2017-06-18 03:00:08	posi_tive_sp_	人 早い 起きる 人 努力 する 初めて 成功 味 真に 噛みしめる  できる   大学 図書館
2017-06-18 01:20:10	posi_tive_sp_	私 人生 岐路 立つ  いつも 困難  道 選ぶ くる
2017-06-18 00:30:09	posi_tive_sp_	できる しょうが 終わる 思う  途中 それ 思う 絶対 達成 できる
2017-06-17 22:50:09	posi_tive_sp_	われわれ 人生 織り糸 織る れる いる 良い 糸 悪い 糸 混じる いる
2017-06-17 22:25:09	posi_tive_sp_	ポジティブ 思考 伝染 する 自分 夢 希望 ある ずっと ポジティブ 言葉 かける られる 続ける 達成 できる
2017-06-17 20:45:14	posi_tive_sp_	ほる ー ら みんな 笑顔 笑う とる ♪ https :// t . co / aqKNUFQcYB
2017-06-17 20:05:10	posi_tive_sp_	たとえ 今日 負ける 人生 続く  ミロスロフ・メチージュ
2017-06-17 16:30:09	posi_tive_sp_	人生 自分 手 つかむ  恋 麗しい サブ
2017-06-17 15:25:11	posi_tive_sp_	結果  誰 分かる お前 自身 後悔 する  人生 一番 必死 なる 電車 男
2017-06-17 14:00:12	posi_tive_sp_	人生 何事 なす あまりに 長い 何事 なす あまりに 短い
2017-06-17 13:20:09	posi_tive_sp_	すぐ できる  なる 限る 今 すぐ 出来る 当たり前 思う 塵 積もる 山 なる
2017-06-17 11:15:11	posi_tive_sp_	人間 志 立てる 遅い すぎる  スタンリー・ボールドウィン
2017-06-17 11:10:09	posi_tive_sp_	 ない 何 出来る 人間  ある 何 出来る 人間   ( 阪急電鉄 創業 者 )
2017-06-17 08:45:11	posi_tive_sp_	馬鹿げる 考え 行動 起こす 世界 変わる  ムーア
2017-06-17 08:30:07	posi_tive_sp_	誰 悩む 心配 する 不安 なる 自分 みんな そう 弱い 駄目  それ 人間 ない なる  いたる 自然
2017-06-17 07:50:11	posi_tive_sp_	まだ 起こる いる  心配 する  これ 鉄則
2017-06-17 07:05:11	posi_tive_sp_	なに あんた 男 いる 幸せ なれる ?@ DJ _ aoi
2017-06-17 06:15:11	posi_tive_sp_	今 戦える  次 来年 言う 資格
2017-06-17 05:20:10	posi_tive_sp_	 叩く 壊す 泳ぐ 川 渡る !!」
2017-06-17 04:35:11	posi_tive_sp_	今日 楽しめる 自分 自身 人生 忘れる がたい  する  N H クラインバウム
2017-06-17 04:20:10	posi_tive_sp_	笑う れる 笑う れる 強い なる
2017-06-17 04:10:07	posi_tive_sp_	とりあえず 笑顔 ! 人 楽しい 笑う  笑う 楽しい ! 口元 笑顔 形 する 相対 的 気分 上 々!!
2017-06-17 03:00:11	posi_tive_sp_	挫折 過程 最後 成功 する 挫折 過程 変わる 成功 する 諦める
2017-06-17 01:20:04	posi_tive_sp_	信念 人 強い する 疑い 活力 麻痺 する せる 信念 力  ロバートソン
2017-06-17 00:30:06	posi_tive_sp_	生 喜び 君 できる 世間 いう  やる  ウォルター・バジョット
2017-06-16 22:50:10	posi_tive_sp_	これ あなた 人生 リハーサル いし
2017-06-16 22:25:09	posi_tive_sp_	人生 一 度  生まれ変わる 生きる いる
2017-06-16 20:45:04	posi_tive_sp_	人生 目的 悟る  ある 生きる  人間 動物
2017-06-16 20:05:07	posi_tive_sp_	昔 できる 今や 求める られる  できる  かっこいい
2017-06-16 16:30:09	posi_tive_sp_	うまい いく いる  周り 人 たくさん 集まる 一番 大切  どん底  誰 そば いる くれる
2017-06-16 15:25:11	posi_tive_sp_	慣習 反対 道 行く そう する 常に 物事 うまい いく  ジャック・ルソー
2017-06-16 14:00:06	posi_tive_sp_	 夜遊び する 幸せ なれる  東国
2017-06-16 13:20:08	posi_tive_sp_	全て 失う れる まだ 未来 残る てる ボヴィー
2017-06-16 11:15:11	posi_tive_sp_	天才 言う れる 人達 最初 長い 時間 練習 できる  最初 長い 時間 勉強 できる  みんな 共通 する  ベビー ステップ  コツコツ 始める  それ 毎日 続ける  そう する 無理 ない だんだん それ 大きい なる いく
2017-06-16 11:10:09	posi_tive_sp_	この世 生きる ゆく  損得 勘定 短い 一生  自分 生きる  生きる  いい
2017-06-16 08:45:07	posi_tive_sp_	あなた 振る 人 運命 人 会う  案内 人
2017-06-16 08:30:09	posi_tive_sp_	物事 取りかかる 一番 早い  あなた 遅い 感じる 瞬間   大学 図書館
2017-06-16 07:50:10	posi_tive_sp_	自分 やれる 今日 違う ! 気持ち 持つ ! そう する 今日 何 違う 気持ち 必然 的 体現 できる  なる くる
2017-06-16 07:05:11	posi_tive_sp_	雨 はねる 一 人 降る  誰 平等 降る  自分 不幸 思う あなた 苦しむ いる 数 みんな 苦しむ  逃げる 向き合う 試練 思う 楽しい なる (
2017-06-16 06:15:07	posi_tive_sp_	結果 気 する  する 結果 毎日 どれ 努力 する 計測 する いく そう する 自ずと 不安 なくなる 結果 つく くる
2017-06-16 05:20:06	posi_tive_sp_	あなた 無駄 する 今日 どれ 人 願う 叶う 未来 ハーバード 大学 図書館
2017-06-16 04:35:06	posi_tive_sp_	顔 悪い  なんで 悪い
2017-06-16 04:20:11	posi_tive_sp_	馬鹿げる 考え 行動 起こす 世界 変わる
2017-06-16 04:10:11	posi_tive_sp_	一 度 ない 人生 自分 夢 追いかける いつ 追いかける  孫
2017-06-16 03:00:07	posi_tive_sp_	運命 そこ どく 俺 通る
2017-06-16 01:20:08	posi_tive_sp_	私 勝つ 続ける  成長 する  負ける 強い なる くる   沙
2017-06-16 00:30:06	posi_tive_sp_	他人 できる ?」 聞く れる とりあえず できる 答える ちゃう  その後 頭 痛い なる 考え抜く 大抵  できる しまう
2017-06-15 22:50:09	posi_tive_sp_	勉強 苦しみ 一瞬  勉強 する 苦しみ 一生 続く   大学 図書館
2017-06-15 22:25:09	posi_tive_sp_	俺 絶対 落ち込む 落ち込む 人  自分  過大 評価 する すぎる 過大 評価 する いる うまい いく 落ち込む  人間 今日 できる  やる  すべて
2017-06-15 20:45:08	posi_tive_sp_	生きる 呼吸 する  行動 する   ジャック・ルソー
2017-06-15 20:05:10	posi_tive_sp_	お前 道 進める 人 勝手  言う せる おく ダンテ・アリギエーリ
2017-06-15 16:30:07	posi_tive_sp_	賢い 人 失敗 する  なぜ 失敗 する  成功 する  どうして 成功 できる  どちら 場合 毎回 理由 考える それ 次に 活かす !!
2017-06-15 15:25:11	posi_tive_sp_	失敗 やめる しまう 失敗 終わる 成功 する 人 成功 する やる  失敗 する 人 紙一重 そう あと 一 歩
2017-06-15 14:00:04	posi_tive_sp_	神様 乗り越える られる 試練 与える JIN - 仁 -
2017-06-15 13:20:11	posi_tive_sp_	どんなに 悔いる 過去 変わる どれほど 心配 する  未来 どう なる  ない いま 現在 最善 尽くす
2017-06-15 11:15:11	posi_tive_sp_	きみ かん ちがう する てる  道 えらぶ  かならずしも 歩く やすい 安全 道 えらぶ   ドラえもん
2017-06-15 11:10:07	posi_tive_sp_	100 点 無理 しれる MAX 出せる
2017-06-15 08:45:05	posi_tive_sp_	99 % ダメ ?? あと 1 % ある
2017-06-15 08:30:11	posi_tive_sp_	過ぎる  悔やむ しょうが 目 どうして 前 つく いる 思う ? 前向き 進む いく  ドラえもん
2017-06-15 07:50:10	posi_tive_sp_	学校 成績 よい いう 社会 認める られる 限る イソップ
2017-06-15 07:05:09	posi_tive_sp_	人 必ず 後悔 する やる 後悔 やる 後悔  良い
2017-06-15 06:15:07	posi_tive_sp_	居眠り する あなた 夢 みる 学習 する あなた 夢 叶う   大学 図書館
2017-06-15 05:20:10	posi_tive_sp_	ハードル 高い 高い くぐる やすい 作者 不詳
2017-06-15 04:35:08	posi_tive_sp_	弱気 相手 強気 する せる 弱気 強気 押し切る れる 強気 弱気 制す いく 強気 強気 押し退ける   一
2017-06-15 04:20:11	posi_tive_sp_	悲しみ 知る てる 人 喜ぶ せる  できる
2017-06-15 04:10:08	posi_tive_sp_	チャレンジ する 失敗 恐れる 何 する  恐れる
2017-06-15 03:00:09	posi_tive_sp_	自分 怒る くれる 人 数 自分 愛す くれる 人 数
2017-06-15 01:20:08	posi_tive_sp_	人 できる きみ できる   ある  ドラえもん
2017-06-15 00:30:11	posi_tive_sp_	今 戦える  次 来年 言う 資格
2017-06-14 22:50:06	posi_tive_sp_	よく みる おく  君 昼寝 する いる 間 時間 流れる 続ける てる 一 秒 待つ くれる 流れる 去る 時間 二度と 帰る くる  ドラえもん
2017-06-14 22:25:06	posi_tive_sp_	チーム 勝利 僕 一番 大切 自分 打てる 誰か 打つ 勝つ  それ いい 考え 間違う いる
2017-06-14 20:45:09	posi_tive_sp_	行動 必ずしも 幸福 もたらす 知れる 行動 ない  幸福 生まれる ベンジャミン・ディズレーリ
2017-06-14 20:05:07	posi_tive_sp_	この世 存在 する 数々 問題 問題 発生 する  考え方 解決 できる
2017-06-14 16:30:10	posi_tive_sp_	われわれ 一 点 余計 入れる する  反す 日本人 点 入れる させる 努力 する いる 練習 日本 選手 キャッチボール 始める われわれ まず バット 握る 打つ  ベーブ・ルース
2017-06-14 15:25:11	posi_tive_sp_	好機 それ 去る しまう 気づく れる  ドンキホーテ
2017-06-14 14:00:10	posi_tive_sp_	私 達 いわば 二 回 この世 生まれる 一 回 目 存在 する  二 回 目 生きる   ジャック・ルソー
2017-06-14 13:20:07	posi_tive_sp_	人生 学校 そこ 幸福 不幸  良い 教師 フリーチェ
2017-06-14 11:15:06	posi_tive_sp_	世の中 君 理解 する  栄光 満ちる いる G K チェスタートン
2017-06-14 11:10:10	posi_tive_sp_	ヒット 打つ 瞬間 自分 頭  レベル 上がる 音 する  ドラゴン クエスト
2017-06-14 08:45:08	posi_tive_sp_	大統領 総理 大臣 代わり いる オレ 代わり いる
2017-06-14 08:30:05	posi_tive_sp_	人間 大切  この世 何 年 生きる いる  この世 どれ 価値 ある  する O .
2017-06-14 07:50:07	posi_tive_sp_	失敗 途中 諦める 失敗
2017-06-14 07:05:11	posi_tive_sp_	私 人生 岐路 立つ  いつも 困難  道 選ぶ くる
2017-06-14 06:15:08	posi_tive_sp_	勝負 勝つ ダメ 感動 与える それだけ ダメ   瑠偉
2017-06-14 05:20:10	posi_tive_sp_	なんとか なる !! どうにか なる !! なんと なる !! 結果 死ぬ とく 全部 オッケー !
2017-06-14 04:35:10	posi_tive_sp_	オッケー いい 感じ ♡ ー ♪✾
2017-06-14 04:20:06	posi_tive_sp_	悪い そう 思える  良い 面 みる どんどん 未来 楽しい なる !」
2017-06-14 04:10:07	posi_tive_sp_	仕事 学校 わける わかる くい つらい  最初 1 か月 !  ぽい 一言 言う とる 間 終わる !!
2017-06-14 03:00:07	posi_tive_sp_	明るい 自分 なる なる いい  誰 あなた 抑える つける 権限 ある せっかく 生まれる くる 命 自由 行く
2017-06-14 01:20:08	posi_tive_sp_	どこ いつ やる 思う できる できる 思う いつ たつ できる
2017-06-14 00:30:11	posi_tive_sp_	それ やる おれ 生まれる くる  考える よい ヘミングウェー
2017-06-13 22:50:08	posi_tive_sp_	! ええ 今日 最高 波乗り 日和 ! スリル 満点 !!」 https :// t . co / orJpmkQXRp
2017-06-13 22:25:09	posi_tive_sp_	私 特別 思う  私 努力 できる 人間 なる ! 思う そう する 結果 出す  本当に 特別 人 変わる いく  できる
2017-06-13 20:45:11	posi_tive_sp_	愛 信仰  日々 ささやか 勤行 維持 する れる ローデンバック
2017-06-13 20:05:08	posi_tive_sp_	好機 それ 去る しまう 気づく れる  ドンキホーテ
2017-06-13 16:30:08	posi_tive_sp_	浪人 時代 挫折 ある 今 ボク ある  あれ 自分 原点   治
2017-06-13 15:25:10	posi_tive_sp_	今 最悪 状況  ? 視点 変える みる !
2017-06-13 14:00:08	posi_tive_sp_	自暴自棄 なる しまう そう なる とりあえず 好き 音楽 がんがん 聞く 寝る
2017-06-13 13:20:09	posi_tive_sp_	魂 殺せる  恐れる 必要 ない  何 恐れる  ある
2017-06-13 11:15:05	posi_tive_sp_	魅力 的 女優  いつ 恋愛 する いる
2017-06-13 11:10:10	posi_tive_sp_	振る れる ? いい こる ! セレブ 結婚 できる チャンス 作り出せる  !
2017-06-13 08:45:11	posi_tive_sp_	小さい  積み重ねる  とんでも  行く ただ ひとつ 道 思う いる
2017-06-13 08:30:08	posi_tive_sp_	自由 生きる  勤勉 生きる  何事 まず 最初 勤勉 さ スタート する  そこ 次第に 自分 自由 する いく 努力 する いく
2017-06-13 07:50:09	posi_tive_sp_	助ける 言える 人 , そう 言える 相手 いる 人 , それ 十分 強い  . ー   ー
2017-06-13 07:05:11	posi_tive_sp_	世の中 君 理解 する  栄光 満ちる いる G K チェスタートン
2017-06-13 06:15:13	posi_tive_sp_	ポジティブパワー 最大限 発揮 する  ある 全然 平気 ! https :// t . co / jAJNRfAKvo
2017-06-13 05:20:08	posi_tive_sp_	お腹 すく いる 何 食べる おいしい 感じる 風邪 治る  元気  感謝 する 一瞬 幸せ 本質
2017-06-13 04:35:10	posi_tive_sp_	ー 今日 さく ...。」← 言う せる !!
2017-06-13 04:10:10	posi_tive_sp_	人 口  甘い それ ある程度 幸せ
2017-06-13 03:00:09	posi_tive_sp_	若い  小さい まとまる とる ! ガン ガン 行く !! 100 万 使う 言う くれる !
2017-06-13 01:20:06	posi_tive_sp_	否定 面 かなぐり捨てる わずか 肯定 面 しがみつく  人間 いま 会社 通用 する (   )
2017-06-13 00:30:10	posi_tive_sp_	毎日 毎日 幸せ 増える く とる ! あんた 生活 ! すごい !
2017-06-12 22:50:07	posi_tive_sp_	ちょっと 疲れる ? ここら ちょっと 茶菓子 ??
2017-06-12 22:25:08	posi_tive_sp_	今日 残業 就職 きん 人 見る  ごい うらやましい  ー ! 幸せ ー !!!
2017-06-12 20:45:08	posi_tive_sp_	ごはん おいしい  幸せ !
2017-06-12 20:05:07	posi_tive_sp_	人間 この世 存在 する  金持ち なる  幸福 なる  スタンダール
2017-06-12 16:30:09	posi_tive_sp_	教師 言う れる 先生 間違い 犯す  ! 誰 失敗 ある ! https :// t . co / KHIgHtsXzb
2017-06-12 15:25:13	posi_tive_sp_	ー !!! ええ ー !!! いい 感じ ー !!! あんた のぼる じょうし !! https :// t . co / t 7 xwD 6 hfnq
2017-06-12 14:00:09	posi_tive_sp_	あんた ガチ 世界 1 番 幸せ !
2017-06-12 13:20:10	posi_tive_sp_	自分 一 人 生きる いる  多く 人 支える られる 生きる いる
2017-06-12 11:15:11	posi_tive_sp_	明日 明日 風 吹く
2017-06-12 11:10:11	posi_tive_sp_	旅行 行く ! 結婚 する ! あと 10 キロ やせる ! ええ ! いま すぐ 準備 する いま すぐ ! やる  とことん やる つくす !
2017-06-12 08:45:09	posi_tive_sp_	最初 ちまちま 途中 普通 最後 がんがん 行く !!
2017-06-12 08:30:11	posi_tive_sp_	諸君 もっとも 容易  はじめ たまう ともかく 始める  ヒルティ 幸福 論
2017-06-12 07:50:10	posi_tive_sp_	成功 しん  生きる とる 成功 しとる  !!
2017-06-12 07:05:10	posi_tive_sp_	オッケー ♪ ー ♡
2017-06-12 06:15:10	posi_tive_sp_	天国 自分 作り出す  ー !!
2017-06-12 05:20:11	posi_tive_sp_	あんた 望み 全て 手 入れる ぞい !!
2017-06-12 04:35:10	posi_tive_sp_	事故 する ちゃう ! 相手 むち打つ ! まあ まあ  日常 茶飯事  ! 俺 ビル 突っ込む 2 人 なぎ倒す !
2017-06-12 04:20:08	posi_tive_sp_	もうかる まっか ? いつも もうかる まう せる !
2017-06-12 04:10:08	posi_tive_sp_	私 この世 必要 する れる 生まれる くる 最高 幸せ 者 世界 宝
2017-06-12 03:00:10	posi_tive_sp_	今 涎 将来 涙 なる   大学 図書館
2017-06-12 01:20:06	posi_tive_sp_	この世 存在 する 数々 問題 問題 発生 する  考え方 解決 できる
2017-06-12 00:30:05	posi_tive_sp_	人生 将棋   自分 手中 ある  チャンス 駒 進め方 P . テレンティウス
2017-06-11 22:50:07	posi_tive_sp_	日本 景気 めっちゃ 上がる 来る とる 知る とる ? 未来 間違い バブル !!
2017-06-11 22:25:05	posi_tive_sp_	人生 一 度  生まれ変わる 生きる いる
2017-06-11 20:45:07	posi_tive_sp_	どんどん 攻める くる ! プレッシャー 歓迎 !!
2017-06-11 20:05:13	posi_tive_sp_	心配 する ! あんた 大物 なる !!! https :// t . co / wfJprowokV
2017-06-11 16:30:11	posi_tive_sp_	ええ ! 自信 もつ ええ !!
2017-06-11 15:25:09	posi_tive_sp_	屋根 落ちる くる 月 よく 見える  なる
2017-06-11 14:00:10	posi_tive_sp_	子供  ずーっと 遊ぶ たい 仕事 する 思う  今 楽しい いい それ 自然 思う存分 遊べる  子供  ない 将来 絶対 仕事 する いける 準備 する おく  いい それ 好き  仕事 できる
2017-06-11 13:20:10	posi_tive_sp_	過去 餅 食える
2017-06-11 11:15:10	posi_tive_sp_	やる  とことん やる  きめる ! お金 好き  使える 一 日 決める 年 2 回 値札 見る 好き 服 買う  軍資金 予定 する 日程 向ける 積み立てる おく  する
2017-06-11 11:10:05	posi_tive_sp_	私 もっと いい 女 なる それ 見る 欲しい
2017-06-11 08:45:10	posi_tive_sp_	苦しみ 避ける られる  むしろ それ 楽しめる   大学 図書館
2017-06-11 08:30:10	posi_tive_sp_	今日 一つ 明日 二つ 勝る フランクリン
2017-06-11 07:50:09	posi_tive_sp_	人 だれ 自分 自身 生涯 一 人 生きる 自分 自身 死 一 人 死ぬ  ヤコブセン
2017-06-11 07:05:09	posi_tive_sp_	人 異郷 生まれる くる 生きる  故郷 求める  考える  生きる  ベルネ
2017-06-11 06:15:09	posi_tive_sp_	あきらめる そこ 試合 終了  監督
2017-06-11 05:20:10	posi_tive_sp_	人 世界一 ゴミ 収集 人 なれる 世界一 モデル なれる たとえ 何 やる それ 世界一 何 問題
2017-06-11 04:35:09	posi_tive_sp_	努力 する 何 できる  なる 人  天才  僕 そう 努力 する 結果 何 できる  なる 人  天才  僕 そう 思う
2017-06-11 04:20:10	posi_tive_sp_	情熱 持つ 1 人 情熱 持つ 100 人 勝る ウォルト・ディズニー
2017-06-11 04:10:08	posi_tive_sp_	 分かれ道 人 通る 道 選ぶ すべて 変わる フロスト
2017-06-11 03:00:11	posi_tive_sp_	自分 立つ いる  深い 掘る そこ きっと 泉 湧く でる
2017-06-11 01:20:09	posi_tive_sp_	学習 人生 全て ない 人生 一部 続く    大学 図書館
2017-06-11 00:30:09	posi_tive_sp_	発明 恋愛 苦しい 思う 苦しい 楽しい 思う これ 楽しい  ある
2017-06-10 22:50:10	posi_tive_sp_	小さい  積み重ねる  とんでも  行く ただ ひとつ 道 思う いる
2017-06-10 22:25:10	posi_tive_sp_	人生 バッターボックス 立つ 見送り 三振 する
2017-06-10 20:45:08	posi_tive_sp_	自分 立つ いる  深い 掘る そこ きっと 泉 湧く でる
2017-06-10 20:05:11	posi_tive_sp_	限界 いつか 来る 周り 言う  仕方 . 自分 作る いける
2017-06-10 16:30:08	posi_tive_sp_	登山 目標 山頂 決まる いる 人生 面白い さ 山頂 かえって 逆境 山 中腹 ある
2017-06-10 15:25:08	posi_tive_sp_	思う 通り 人生 ない よい 言える 人生 しれる アルセーヌ・メルセデス・ヒロコ
2017-06-10 14:00:06	posi_tive_sp_	現状 維持 後退 する ウォルト・ディズニー
2017-06-10 13:20:10	posi_tive_sp_	道 はじ ぶん つくる 道 はじ ぶん ひらく 人 つくる  はじ ぶん 道 なる
2017-06-10 11:15:11	posi_tive_sp_	人生 喜び 君 できる 世間 いう  やる  ウォルター・バジョット
2017-06-10 11:10:05	posi_tive_sp_	今日 やる  明日 やる 何 倍 良い   大学 図書館
2017-06-10 08:45:11	posi_tive_sp_	状況 ? 何 状況 俺 状況 つくる  ナポレオン・ボナパルト
2017-06-10 08:30:11	posi_tive_sp_	私 達 いわば 二 回 この世 生まれる 一 回 目 存在 する  二 回 目 生きる   ジャック・ルソー
2017-06-10 07:50:11	posi_tive_sp_	なやむ いる ひま 一つ やる ドラえもん
2017-06-10 07:05:10	posi_tive_sp_	もし 人生 二 回 ある お母さん 言う  高校 行く 一 回 ない  自分 好き する せる くださる   勝
2017-06-10 06:15:11	posi_tive_sp_	転ぶ 起き上がれる ばいいん 子供 転ぶ 何 回 起き上がる くる !!
2017-06-10 05:20:10	posi_tive_sp_	あなた 考え方 変える なさる そう する あなた 世界 変える  できる  ( ノーマン・ヴィンセント・ピール )
2017-06-10 04:35:07	posi_tive_sp_	転ぶ つま づく する 気づく  わかる  ある 痛む つらい さ わかる  なる  ある
2017-06-10 04:20:07	posi_tive_sp_	生む くれる 生かせる くれる
2017-06-10 04:10:11	posi_tive_sp_	ちゃんと 自分 やる  がんばる  見つかる それ 向かう 少し 走り出す  社会 出る なん 違う  よく ある 仕事 選ぶ れる いける ブラック 会社 就職 する いける
2017-06-10 03:00:10	posi_tive_sp_	努力 する する 報う れる 嘘 60 % 本当 40 % 場合 ある
2017-06-10 01:20:09	posi_tive_sp_	ベル 鳴らす ベル 歌 歌う 歌 人生 楽しむ 人生 ーオスカー・ハマースタインー
2017-06-10 00:30:11	posi_tive_sp_	利益 あと 付く くる なんで 私  する いける 思う やる みる !
2017-06-09 22:50:06	posi_tive_sp_	人生 終わる しまう  恐れる いける 人生 いつ 始まる  怖い   ハンセン
