2017-05-11 13:20:10	posi_tive_sp_	好機 それ 去る しまう 気づく れる  ドンキホーテ
2017-05-11 11:15:06	posi_tive_sp_	浪人 時代 挫折 ある 今 ボク ある  あれ 自分 原点   治
2017-05-11 11:10:07	posi_tive_sp_	今 最悪 状況  ? 視点 変える みる !
2017-05-11 08:45:07	posi_tive_sp_	自暴自棄 なる しまう そう なる とりあえず 好き 音楽 がんがん 聞く 寝る
2017-05-11 08:30:10	posi_tive_sp_	魂 殺せる  恐れる 必要 ない  何 恐れる  ある
2017-05-11 07:50:10	posi_tive_sp_	魅力 的 女優  いつ 恋愛 する いる
2017-05-11 07:05:10	posi_tive_sp_	振る れる ? いい こる ! セレブ 結婚 できる チャンス 作り出せる  !
2017-05-11 06:15:10	posi_tive_sp_	小さい  積み重ねる  とんでも  行く ただ ひとつ 道 思う いる
2017-05-11 05:20:11	posi_tive_sp_	自由 生きる  勤勉 生きる  何事 まず 最初 勤勉 さ スタート する  そこ 次第に 自分 自由 する いく 努力 する いく
2017-05-11 04:35:09	posi_tive_sp_	助ける 言える 人 , そう 言える 相手 いる 人 , それ 十分 強い  . ー   ー
2017-05-11 04:20:08	posi_tive_sp_	世の中 君 理解 する  栄光 満ちる いる G K チェスタートン
2017-05-11 04:10:13	posi_tive_sp_	ポジティブパワー 最大限 発揮 する  ある 全然 平気 !
2017-05-11 03:00:11	posi_tive_sp_	お腹 すく いる 何 食べる おいしい 感じる 風邪 治る  元気  感謝 する 一瞬 幸せ 本質
2017-05-11 01:20:09	posi_tive_sp_	ー 今日 さく ...。」← 言う せる !!
2017-05-11 00:30:13	posi_tive_sp_	大丈夫 ! あんた やる 空 飛べる ! 自分 可能 性 自信 持つ ええ !!
2017-05-10 22:50:11	posi_tive_sp_	人 口  甘い それ ある程度 幸せ
2017-05-10 22:25:07	posi_tive_sp_	若い  小さい まとまる とる ! ガン ガン 行く !! 100 万 使う 言う くれる !
2017-05-10 20:45:10	posi_tive_sp_	否定 面 かなぐり捨てる わずか 肯定 面 しがみつく  人間 いま 会社 通用 する (   )
2017-05-10 20:05:06	posi_tive_sp_	毎日 毎日 幸せ 増える く とる ! あんた 生活 ! すごい !
2017-05-10 16:30:11	posi_tive_sp_	ちょっと 疲れる ? ここら ちょっと 茶菓子 ??
2017-05-10 15:25:11	posi_tive_sp_	今日 残業 就職 きん 人 見る  ごい うらやましい  ー ! 幸せ ー !!!
2017-05-10 14:00:10	posi_tive_sp_	ごはん おいしい  幸せ !
2017-05-10 13:20:06	posi_tive_sp_	人間 この世 存在 する  金持ち なる  幸福 なる  スタンダール
2017-05-10 11:15:11	posi_tive_sp_	教師 言う れる 先生 間違い 犯す  ! 誰 失敗 ある ! https :// t . co / 1 Nox 99 qaiE
2017-05-10 11:10:15	posi_tive_sp_	ー !!! ええ ー !!! いい 感じ ー !!! あんた のぼる じょうし !! https :// t . co / N 3 hKIQlJec
2017-05-10 08:45:08	posi_tive_sp_	あんた ガチ 世界 1 番 幸せ !
2017-05-10 08:30:09	posi_tive_sp_	自分 一 人 生きる いる  多く 人 支える られる 生きる いる
2017-05-10 07:50:10	posi_tive_sp_	明日 明日 風 吹く
2017-05-10 07:05:07	posi_tive_sp_	旅行 行く ! 結婚 する ! あと 10 キロ やせる ! ええ ! いま すぐ 準備 する いま すぐ ! やる  とことん やる つくす !
2017-05-10 06:15:10	posi_tive_sp_	最初 ちまちま 途中 普通 最後 がんがん 行く !!
2017-05-10 05:20:09	posi_tive_sp_	諸君 もっとも 容易  はじめ たまう ともかく 始める  ヒルティ 幸福 論
2017-05-10 04:35:08	posi_tive_sp_	成功 しん  生きる とる 成功 しとる  !!
2017-05-10 04:20:08	posi_tive_sp_	オッケー ♪ ー ♡
2017-05-10 04:10:11	posi_tive_sp_	天国 自分 作り出す  ー !!
2017-05-10 03:00:05	posi_tive_sp_	あんた 望み 全て 手 入れる ぞい !!
2017-05-10 01:20:10	posi_tive_sp_	事故 する ちゃう ! 相手 むち打つ ! まあ まあ  日常 茶飯事  ! 俺 ビル 突っ込む 2 人 なぎ倒す !
2017-05-10 00:30:10	posi_tive_sp_	もうかる まっか ? いつも もうかる まう せる !
2017-05-09 22:50:04	posi_tive_sp_	私 この世 必要 する れる 生まれる くる 最高 幸せ 者 世界 宝
2017-05-09 22:25:06	posi_tive_sp_	今 涎 将来 涙 なる   大学 図書館
2017-05-09 20:45:10	posi_tive_sp_	この世 存在 する 数々 問題 問題 発生 する  考え方 解決 できる
2017-05-09 20:05:09	posi_tive_sp_	人生 将棋   自分 手中 ある  チャンス 駒 進め方 P . テレンティウス
2017-05-09 16:30:06	posi_tive_sp_	日本 景気 めっちゃ 上がる 来る とる 知る とる ? 未来 間違い バブル !!
2017-05-09 15:25:06	posi_tive_sp_	人生 一 度  生まれ変わる 生きる いる
2017-05-09 14:00:11	posi_tive_sp_	どんどん 攻める くる ! プレッシャー 歓迎 !!
2017-05-09 13:20:10	posi_tive_sp_	心配 する ! あんた 大物 なる !!! https :// t . co / ajmBBhfAAG
2017-05-09 11:15:07	posi_tive_sp_	ええ ! 自信 もつ ええ !!
2017-05-09 11:10:11	posi_tive_sp_	屋根 落ちる くる 月 よく 見える  なる
2017-05-09 08:45:10	posi_tive_sp_	子供  ずーっと 遊ぶ たい 仕事 する 思う  今 楽しい いい それ 自然 思う存分 遊べる  子供  ない 将来 絶対 仕事 する いける 準備 する おく  いい それ 好き  仕事 できる
2017-05-09 08:30:10	posi_tive_sp_	過去 餅 食える
2017-05-09 07:50:07	posi_tive_sp_	やる  とことん やる  きめる ! お金 好き  使える 一 日 決める 年 2 回 値札 見る 好き 服 買う  軍資金 予定 する 日程 向ける 積み立てる おく  する
2017-05-09 07:05:06	posi_tive_sp_	私 もっと いい 女 なる それ 見る 欲しい
2017-05-09 06:15:08	posi_tive_sp_	苦しみ 避ける られる  むしろ それ 楽しめる   大学 図書館
2017-05-09 05:20:10	posi_tive_sp_	今日 一つ 明日 二つ 勝る フランクリン
2017-05-09 04:35:11	posi_tive_sp_	人 だれ 自分 自身 生涯 一 人 生きる 自分 自身 死 一 人 死ぬ  ヤコブセン
2017-05-09 04:20:09	posi_tive_sp_	人 異郷 生まれる くる 生きる  故郷 求める  考える  生きる  ベルネ
2017-05-09 04:10:08	posi_tive_sp_	あきらめる そこ 試合 終了  監督
2017-05-09 03:00:05	posi_tive_sp_	人 世界一 ゴミ 収集 人 なれる 世界一 モデル なれる たとえ 何 やる それ 世界一 何 問題
2017-05-09 01:20:11	posi_tive_sp_	努力 する 何 できる  なる 人  天才  僕 そう 努力 する 結果 何 できる  なる 人  天才  僕 そう 思う
2017-05-09 00:30:10	posi_tive_sp_	情熱 持つ 1 人 情熱 持つ 100 人 勝る ウォルト・ディズニー
2017-05-08 22:50:11	posi_tive_sp_	 分かれ道 人 通る 道 選ぶ すべて 変わる フロスト
2017-05-08 22:25:07	posi_tive_sp_	自分 立つ いる  深い 掘る そこ きっと 泉 湧く でる
2017-05-08 20:45:09	posi_tive_sp_	学習 人生 全て ない 人生 一部 続く    大学 図書館
2017-05-08 20:05:05	posi_tive_sp_	発明 恋愛 苦しい 思う 苦しい 楽しい 思う これ 楽しい  ある
2017-05-08 16:30:07	posi_tive_sp_	小さい  積み重ねる  とんでも  行く ただ ひとつ 道 思う いる
2017-05-08 15:25:08	posi_tive_sp_	人生 バッターボックス 立つ 見送り 三振 する
2017-05-08 14:00:11	posi_tive_sp_	自分 立つ いる  深い 掘る そこ きっと 泉 湧く でる
2017-05-08 13:20:08	posi_tive_sp_	限界 いつか 来る 周り 言う  仕方 . 自分 作る いける
2017-05-08 11:15:08	posi_tive_sp_	登山 目標 山頂 決まる いる 人生 面白い さ 山頂 かえって 逆境 山 中腹 ある
2017-05-08 11:10:06	posi_tive_sp_	思う 通り 人生 ない よい 言える 人生 しれる アルセーヌ・メルセデス・ヒロコ
2017-05-08 08:45:08	posi_tive_sp_	現状 維持 後退 する ウォルト・ディズニー
2017-05-08 08:30:11	posi_tive_sp_	道 はじ ぶん つくる 道 はじ ぶん ひらく 人 つくる  はじ ぶん 道 なる
2017-05-08 07:50:10	posi_tive_sp_	人生 喜び 君 できる 世間 いう  やる  ウォルター・バジョット
2017-05-08 07:05:09	posi_tive_sp_	今日 やる  明日 やる 何 倍 良い   大学 図書館
2017-05-08 06:15:08	posi_tive_sp_	状況 ? 何 状況 俺 状況 つくる  ナポレオン・ボナパルト
2017-05-08 05:20:10	posi_tive_sp_	私 達 いわば 二 回 この世 生まれる 一 回 目 存在 する  二 回 目 生きる   ジャック・ルソー
2017-05-08 04:35:11	posi_tive_sp_	なやむ いる ひま 一つ やる ドラえもん
2017-05-08 04:20:11	posi_tive_sp_	もし 人生 二 回 ある お母さん 言う  高校 行く 一 回 ない  自分 好き する せる くださる   勝
2017-05-08 04:10:09	posi_tive_sp_	転ぶ 起き上がれる ばいいん 子供 転ぶ 何 回 起き上がる くる !!
2017-05-08 03:00:11	posi_tive_sp_	あなた 考え方 変える なさる そう する あなた 世界 変える  できる  ( ノーマン・ヴィンセント・ピール )
2017-05-08 01:20:10	posi_tive_sp_	転ぶ つま づく する 気づく  わかる  ある 痛む つらい さ わかる  なる  ある
2017-05-08 00:30:11	posi_tive_sp_	生む くれる 生かせる くれる
2017-05-07 22:50:11	posi_tive_sp_	ちゃんと 自分 やる  がんばる  見つかる それ 向かう 少し 走り出す  社会 出る なん 違う  よく ある 仕事 選ぶ れる いける ブラック 会社 就職 する いける
2017-05-07 22:25:09	posi_tive_sp_	努力 する する 報う れる 嘘 60 % 本当 40 % 場合 ある
2017-05-07 20:45:11	posi_tive_sp_	ベル 鳴らす ベル 歌 歌う 歌 人生 楽しむ 人生 ーオスカー・ハマースタインー
2017-05-07 20:05:09	posi_tive_sp_	利益 あと 付く くる なんで 私  する いける 思う やる みる !
2017-05-07 16:30:11	posi_tive_sp_	人生 終わる しまう  恐れる いける 人生 いつ 始まる  怖い   ハンセン
2017-05-07 15:25:05	posi_tive_sp_	! もう ひと 踏ん張る !
2017-05-07 14:00:14	posi_tive_sp_	元気 ない  やる ー !」 思う ポーズ 10 秒 しとる 嫌 元気 なる くる  !! https :// t . co / 9 IsbO 9 oK 8 J
2017-05-07 13:20:11	posi_tive_sp_	人 異郷 生まれる くる 生きる  故郷 求める  考える  生きる  ベルネ
2017-05-07 11:15:08	posi_tive_sp_	ここ ちょっと 休む くる ー !
2017-05-07 11:10:09	posi_tive_sp_	いま ここ !
2017-05-07 08:45:08	posi_tive_sp_	あんま 気 する ー 自分 思う いる 他人 君  気 する てる
2017-05-07 08:30:11	posi_tive_sp_	人生 勝ち負け 負け たって 言う 人 勝ち
2017-05-07 07:50:08	posi_tive_sp_	黒 白 ない グレー  ある   気づく  割り切れる  ある  人生
2017-05-07 07:05:07	posi_tive_sp_	人生 楽しむ 損 !!
2017-05-07 06:15:09	posi_tive_sp_	人生 バッターボックス 立つ 見送り 三振 する
2017-05-07 05:20:12	posi_tive_sp_	今日 笑顔 大賞 3 位 https :// t . co / q 6 JGWr 0 KcT
2017-05-07 04:35:09	posi_tive_sp_	慣習 反対 道 行く そう する 常に 物事 うまい いく  ジャック・ルソー
2017-05-07 04:20:06	posi_tive_sp_	明日 変わる 言葉 今 できる ストレス たまる いる 言い換える  できる ストレス 解消 する  とにかく リラックス する
2017-05-07 04:10:05	posi_tive_sp_	あきらめる そこ 試合 終了  監督
2017-05-07 03:00:11	posi_tive_sp_	お前 いつか 出会う 災い おまえ おろそか する 時間 報い ナポレオン・ボナパルト
2017-05-07 01:20:08	posi_tive_sp_	結果 ちゃんと つく くる
2017-05-07 00:30:05	posi_tive_sp_	我々 誕生  受け取る 人生 真 人生 前渡し 過ぎる 真 人生 我々 一 人 見つける なる P . ギュット
2017-05-06 22:50:08	posi_tive_sp_	もし 金持ち なる  少し ある  焦点 絞る 駄目  キヨ
2017-05-06 22:25:04	posi_tive_sp_	笑う 門 福 来る よく 言う あれ 本当 !
2017-05-06 20:45:12	posi_tive_sp_	笑える  こう やる いや 笑える くる  https :// t . co / QAe 1 sli 2 vb
2017-05-06 20:05:09	posi_tive_sp_	人生 一 秒 変える 方法 !! 1 : 辛い  前 向く !」 2 : いま 谷 いる 自覚 する その後 登る 思う ! 3 : 自分 思い 癖 負ける !」
2017-05-06 16:30:10	posi_tive_sp_	ー 気合い 入れる くる ー !!!!
2017-05-06 15:25:14	posi_tive_sp_	新人 失敗 する  作法 こう https :// t . co / yZSrkCmax 0
2017-05-06 14:00:07	posi_tive_sp_	ええ ー ! 失敗 する ちゃんと 正す  ポジティブ ! 失敗 する どう ええ ポジティブ ワイルド ー !」 !
2017-05-06 13:20:10	posi_tive_sp_	人生 短い たとえ それ 長い 思う 過ごす いる 人 たち A . モーロア
2017-05-06 11:15:11	posi_tive_sp_	人間 志 立てる 遅い すぎる  ボールドウィン
2017-05-06 11:10:11	posi_tive_sp_	今日 行なう 善行 ある すぐ 実行 する 決して 明日 延ばす ジョフリー・チョーサー
2017-05-06 08:45:05	posi_tive_sp_	人生 10 段 変速 自転車   だれ 自分 もつ いる 大半 使う いる
2017-05-06 08:30:11	posi_tive_sp_	僕 耳 世界 一番 笑い 聞く 耳 する
2017-05-06 07:50:10	posi_tive_sp_	言葉 傷つける   ない 伝える
2017-05-06 07:05:10	posi_tive_sp_	ええ 完璧 ゃなくてもちょっとずれとってもええねん !
2017-05-06 06:15:10	posi_tive_sp_	失敗 ない  教訓 !!!」
2017-05-06 05:20:10	posi_tive_sp_	おおげさ  する ええ 今 できる 一番 簡単 シンプル  すぐ やる ! 結局 それ 積み重ね !
2017-05-06 04:35:08	posi_tive_sp_	いい 加減 いい 加減 気楽 気楽
2017-05-06 04:20:10	posi_tive_sp_	不可能 思う  人間 決して 敗北 する デール・カーネギー
2017-05-06 04:10:06	posi_tive_sp_	私 たち 人生 私 たち 費やす 努力 価値 ある モーリアック
2017-05-06 03:00:12	posi_tive_sp_	第三者 評価 気 する 自分 満足 どう 結局 幸せ つながる
2017-05-06 01:20:07	posi_tive_sp_	Think but feel .「 考える  感じ取る  ポジティブ まさに 通り
2017-05-06 00:30:05	posi_tive_sp_	諦める 一度 諦める それ 習慣 なる がんばる ! ベアーズ
2017-05-05 22:50:13	posi_tive_sp_	ほる ほほ ! ほほ ! ほる ほほ ー !!! https :// t . co / whpoBZaw 3 f
2017-05-05 22:25:10	posi_tive_sp_	ー !!! 今日 楽しめる ー !! 人生 楽しい  いっぱい !
2017-05-05 20:45:07	posi_tive_sp_	You can start with nothing . And out of nothing , and out of no way , a way will be made .- Michael
2017-05-05 20:05:10	posi_tive_sp_	小さい  一つ 一番 重要  ! 成功 結局 毎日 小さい 行動 積み重ね 過ぎる  ! これ 気付く 人 成功 する !
2017-05-05 16:30:14	posi_tive_sp_	何もかも 忘れる 笑う とる こう やる 隣 人 笑う くれる  ! https :// t . co / FYIcXedpG 3
2017-05-05 15:25:10	posi_tive_sp_	決断 1 秒 決める 下さる 何 する  3 分 かかる 決める いたむ チャンス 神 逃げる しまう
2017-05-05 14:00:09	posi_tive_sp_	あんた あんた  ええ !! それ ええ !
2017-05-05 13:20:11	posi_tive_sp_	人 褒める 人 人 褒める られる
2017-05-05 11:15:07	posi_tive_sp_	大切  自分 過信 する オ メデタい さ 勝手 自分 上限 想像 する 強い さ !
2017-05-05 11:10:07	posi_tive_sp_	とりあえず 楽しい  考える 前向き なる 自分 イメージ する  始める みる どう ?!
2017-05-05 08:45:06	posi_tive_sp_	ぽい ぃぶ マイペース !
2017-05-05 08:30:07	posi_tive_sp_	昨日 今日 今日 明日 明日 明後日 日々 変わる 続ける  大切 パスカル バルボ
2017-05-05 07:50:08	posi_tive_sp_	人 注意 する れる なんとなく むかう くる  ある 相手 言う いる  正しい 思う それ 従う  将来 あなた 確実 いい 結果 返る くる
2017-05-05 07:05:11	posi_tive_sp_	完璧 7 割 程度 ええ ! 大丈夫 やる  完璧 する 寿命 10 年 伸びる  !
2017-05-05 06:15:06	posi_tive_sp_	昨日 今日 今日 明日 明日 明後日 日々 変わる 続ける  大切 パスカル バルボ
2017-05-05 05:20:11	posi_tive_sp_	今日 楽しい  絶対 3 つや ろう 決める ええ !
2017-05-05 04:35:06	posi_tive_sp_	あなた 笑顔 友達 家族 喜び 感じる 人 いる きっと あなた 笑顔 見る 喜び 感じる 人 いる 今 集中 する 必要 ある
2017-05-05 04:20:09	posi_tive_sp_	やる ! ええ !! どんどん どんどん 良い なる 来る とる !!
2017-05-05 04:10:11	posi_tive_sp_	あなた 目 前 10 人 人 いる あなた 10 人 全員 好き なれる ? あなた 目 前 10 人 人 いる 全員 あなた  好き
2017-05-05 03:00:09	posi_tive_sp_	既に 起こる  これから 起こる  結果 どう あれ 必ず 自分  なる いる
2017-05-05 01:20:09	posi_tive_sp_	いっそう 愛する  除く 恋 治療 法 ソロー
2017-05-05 00:30:09	posi_tive_sp_	ぽい ぽい ぽい ぽん ♪ ぽい ぽい ぽい ぽん ♪ ぽい ぽい ぽい ぽん ♪
2017-05-04 22:50:10	posi_tive_sp_	人生 つくる  必然 姿
2017-05-04 22:25:05	posi_tive_sp_	例える 笑う れる 一生懸命 努力 する  結果 つく くる もしも 結果 つく くる 努力 方向 性 見直す 成功 向かう いく
2017-05-04 20:45:10	posi_tive_sp_	自分 そう 決める . これ 私 意志 決める 道 .」 言える そこ ゴール !
2017-05-04 20:05:08	posi_tive_sp_	あんた 笑顔 しゃべる それ 今日 一 日 嬉しい なる 人 いる たった それだけ
2017-05-04 16:30:10	posi_tive_sp_	健康 笑う いる られる  しあわせ
2017-05-04 15:25:06	posi_tive_sp_	間違う いる わかる 改める  間違う  放置 する
2017-05-04 14:00:10	posi_tive_sp_	今日 する なる  何 問いかける  今日 心 喜ぶ する  何 問いかける ! 問いかける 質 変える そこ 異なる 人生 待つ いる !
2017-05-04 13:20:11	posi_tive_sp_	深い 考える なん ほる  口 する やつ おる やつ いつか 痛い 目 見る ! 気 する ー !
2017-05-04 11:15:09	posi_tive_sp_	みんな ちがう みんな いい
2017-05-04 11:10:11	posi_tive_sp_	状況 ? 何 状況 俺 状況 つくる  ナポレオン・ボナパルト
2017-05-04 08:45:11	posi_tive_sp_	やる おく よい 人生 やる おく よい 人生 どっち ええ  考え ー !
2017-05-04 08:30:05	posi_tive_sp_	僕 知る いる ドーピング ひとつ 努力
2017-05-04 07:50:10	posi_tive_sp_	たとえ 信念 ある 達成 できる  極 わずか  信念 ない 何事 達成 できる  バトル
2017-05-04 07:05:07	posi_tive_sp_	我々 一生 前半 親 後半 子供 台無し する れる クラレンス・ S ダロウ
2017-05-04 06:15:09	posi_tive_sp_	私 たち 人生 私 たち 費やす 努力 価値 ある モーリアック
2017-05-04 05:20:08	posi_tive_sp_	人間 大切  この世 何 年 生きる いる  この世 どれ 価値 ある  する O .
2017-05-04 04:35:11	posi_tive_sp_	今日 日 残り 人生 最初 一 日 アメリカン ビューティー
2017-05-04 04:20:10	posi_tive_sp_	剣 折れる 私 折れる 剣 端 握る あくまで 戦う  ド ゴール
2017-05-04 04:10:08	posi_tive_sp_	黒髪 生える くる  それ 一番 似合う てる  金髪 似合う  なる 金髪 生える くる
2017-05-04 03:00:09	posi_tive_sp_	哀しみ 自分 すり減らす いける 死ぬ 人 死ぬ 人 人生 生きる いる   ある  愛 死
2017-05-04 01:20:11	posi_tive_sp_	大抵  自分 思いがける すばらしい 勇気 持つ いる デール・カーネギー
2017-05-04 00:30:10	posi_tive_sp_	人生 道路   一番 近道 たいてい 一番 悪い 道  ベーコン
2017-05-03 22:50:05	posi_tive_sp_	行動 必ずしも 幸福 もたらす 知れる 行動 ない  幸福 生まれる ベンジャミン・ディズレーリ
2017-05-03 22:25:08	posi_tive_sp_	乗りかける 船 ためらう 乗る しまう ツルゲーネフ
2017-05-03 20:45:09	posi_tive_sp_	安全 道 求める 人 痛み 与える  ない 義手 義足 取り替える  自分 手足 切り離す 人
2017-05-03 20:05:11	posi_tive_sp_	今日 一つ 明日 二つ 勝る フランクリン
2017-05-03 16:30:07	posi_tive_sp_	明日 明日 人 それ なだめる 明日 彼 墓場 送り込む  ツルゲーネフ
2017-05-03 15:25:05	posi_tive_sp_	現状 維持 後退 する ウォルト・ディズニー
2017-05-03 14:00:07	posi_tive_sp_	今日 歩く  止める 明日 走る ない   大学 図書館
2017-05-03 13:20:08	posi_tive_sp_	われわれ 現在 耐え忍ぶ よい 過去 未来 苦しむ 必要 過去 もう 存在 する 未来 まだ 存在 する いる
2017-05-03 11:15:10	posi_tive_sp_	偶然 うまい 返せる  見える 一 球 僕 何 千 球 練習 する  一 球
2017-05-03 11:10:09	posi_tive_sp_	お前 いつか 出会う 災い おまえ おろそか する 時間 報い ナポレオン・ボナパルト
2017-05-03 08:45:08	posi_tive_sp_	自分 行動 する  すべて 取る 足る  しれる 行動 する  重要  ガンディー
2017-05-03 08:30:11	posi_tive_sp_	人 負ける 仕事 する 勝てる 堂々
2017-05-03 07:50:10	posi_tive_sp_	今 やる いる  好き  もっと いい 選択肢 たくさん ある 今 既成 概念 すべて ない  知る 下さる 狭い 井戸 既成 概念 抜け出す みる
2017-05-03 07:05:11	posi_tive_sp_	今 できる  最前 尽くす
2017-05-03 06:15:08	posi_tive_sp_	何 する いい わかる お金 ためる やる  見つかる  お金 ない できる  悔しい
2017-05-03 05:20:10	posi_tive_sp_	年中 戦争 する いる 国 ある 年中 平和 国 ある ここ 学べる  ? 環境 変える  つき合う 人 変える  大事
2017-05-03 04:35:07	posi_tive_sp_	勝ち 不思議 勝ち ある 負け 不思議 負け ない
2017-05-03 04:20:11	posi_tive_sp_	やめる ちゃう ?! もったいない !
2017-05-03 04:10:10	posi_tive_sp_	本当に それ 相手 思う てる  ? 一 度 思い込み 捨てる みる よい 考える みる それ 解決 する 人間 関係 悩み 結構 ある
2017-05-03 03:00:12	posi_tive_sp_	ポジティブ ビッグ スマイル 生まれる  !!
2017-05-03 01:20:10	posi_tive_sp_	自分 行動 する  すべて 取る 足る  しれる 行動 する  重要
2017-05-03 00:30:11	posi_tive_sp_	希望 人 成功 導く 信仰 希望 ない 何事 成就 する
2017-05-02 22:50:09	posi_tive_sp_	嫌  ひとまず 考える 他  考える !」
2017-05-02 22:25:07	posi_tive_sp_	いかに 死ぬ いつ 死ぬ 選ぶ  できる 選べる  いかに 生きる それだけ  バエズ
2017-05-02 20:45:10	posi_tive_sp_	でぶ 言う れる ?「 お前 だめ 言う れる ?  簡単 他人 気 する ! あんた 未来 相手  !
2017-05-02 20:05:06	posi_tive_sp_	歩く いる どこ たどりつく 行動 する いつか たどり着く
2017-05-02 16:30:08	posi_tive_sp_	Do small things every day .」
2017-05-02 15:25:10	posi_tive_sp_	学校 成績 よい いう 社会 認める られる 限る イソップ
2017-05-02 14:00:10	posi_tive_sp_	不安 後悔 堂々 巡る する だす 底抜け 明るい 音楽 聴く そのまま 寝る える ー 起きる すっかり 忘れる とる
2017-05-02 13:20:10	posi_tive_sp_	自分 考える  生きる なる そう 自分 生きる  考える しまう ブールジュ
2017-05-02 11:15:08	posi_tive_sp_	自分 人生 肩代わり する くれる 人 いる 懸命 自分 辛い 状況 乗り越える する それ 繰り返す  人 人生 間違い 豊か する いる
2017-05-02 11:10:07	posi_tive_sp_	人 力 借りる  する そう する あなた 1 日 2 倍 行動 量 こなせる  なる 世の中 力 貸す 人 溢れる かえる いる
2017-05-02 08:45:11	posi_tive_sp_	ちょっと 太る てる ? ! もっと かわいい なれる 素質 めっちゃ 眠る とる  ー ! ええ  !
2017-05-02 08:30:07	posi_tive_sp_	他人 比べる てる 自分 落ち込む  自分 自分 ! 前 向く 歩く !
2017-05-02 07:50:05	posi_tive_sp_	一見 する 人生 何 意味 ない 一つ 意味 ない  ある 得る
2017-05-02 07:05:10	posi_tive_sp_	生きる 生きる られる 人 いる  時々 思い出す
2017-05-02 06:15:10	posi_tive_sp_	人 短所 見つける 騒ぐ 人 自分 評判 落とす 人 人 短所 見つける 黙る おく 人 静か 縁 切れる 人 人 長所 見つける 黙る おく 人 冷静 他人 評価 できる 人 人 長所 見つける 褒める あげる られる 人 豊か 人間 関係 築く 自身 たくさん 得する 人
2017-05-02 05:20:07	posi_tive_sp_	成功 する 成功 する 決して 諦める
2017-05-02 04:35:10	posi_tive_sp_	心 折れる そう  全部 投げ捨てる 太陽 光 浴びる 散歩 する 下さる 物事 進む あなた 心 折れる   大事  ストレス 解消 する れる いる 場合 ほとんど
2017-05-02 04:20:10	posi_tive_sp_	いつか できる  すべて 今日 できる  ド・モンテーニュ
2017-05-02 04:10:10	posi_tive_sp_	傷つく  生きる
2017-05-02 03:00:10	posi_tive_sp_	運 いい 思う てる 人 一番 運 いい
2017-05-02 01:20:07	posi_tive_sp_	今 今 ない 今 さらう 流す 生きる いく 必ず 数 か月 さらう 流す しまう 人間 なる 数 か月 さらう 流す しまう 必ず 人生 さらう 流す しまう
2017-05-02 00:30:09	posi_tive_sp_	最後 笑う  お金 権力 バカポジティブ 思考 持つ 人間
2017-05-01 22:50:05	posi_tive_sp_	人生 つくる  必然 姿
2017-05-01 22:25:07	posi_tive_sp_	人生 勝ち負け 負け たって 言う 人 勝ち
2017-05-01 20:45:09	posi_tive_sp_	いつも 心 いっぱい 動かす 生きる いる 人 それ 現役 倍 賞
